{
  "schemaVersion": "agent-eval-operational-escalation-matrix-1",
  "id": "operational-escalation-matrix-fixture-1",
  "version": "0.1.0",
  "owner": {
    "id": "fixture-governance-owner",
    "role": "governance_owner"
  },
  "rows": [
    {
      "eventId": "hardGateRegression",
      "claimEffect": "insufficient_evidence",
      "governanceStatus": "manual_review_required",
      "stopAction": "close_run",
      "scopeAction": "reject_or_reduce",
      "waivable": false,
      "triggerContract": {
        "id": "trigger-contract-hardGateRegression",
        "uri": "artifact:fixture:trigger-contract-hardGateRegression",
        "digest": "sha256:0700880438272aeb67dc816cb04b74219cebd0f43619073869aefcf982987109"
      },
      "owner": {
        "id": "fixture-governance-owner",
        "role": "governance_owner"
      },
      "slaSeconds": 3600,
      "requiredEvidenceKinds": [
        "canonical_event_evidence"
      ],
      "terminalDisposition": "not_applicable_while_open",
      "resumeContract": {
        "id": "resume-contract-hardGateRegression",
        "uri": "artifact:fixture:resume-contract-hardGateRegression",
        "digest": "sha256:9d9354160687c721dd2ee70e73bd3b85cc4d659f5f95944dd9619968976948d7"
      },
      "rowDigest": "sha256:98b696457c5d6dae500df145c5d7adcd5ea816de99c1f060f9e230d36148702f"
    },
    {
      "eventId": "untriagedCriticalScannerFinding",
      "claimEffect": "insufficient_evidence",
      "governanceStatus": "security_review_required",
      "stopAction": "block_acceptance",
      "scopeAction": "reject_or_reduce",
      "waivable": true,
      "triggerContract": {
        "id": "trigger-contract-untriagedCriticalScannerFinding",
        "uri": "artifact:fixture:trigger-contract-untriagedCriticalScannerFinding",
        "digest": "sha256:538a71e46b030d988850ab132c9347a38a93b1cb5c7312d2c27c299b0b286ea4"
      },
      "owner": {
        "id": "fixture-governance-owner",
        "role": "governance_owner"
      },
      "slaSeconds": 3600,
      "requiredEvidenceKinds": [
        "canonical_event_evidence"
      ],
      "terminalDisposition": "not_applicable_while_open",
      "resumeContract": {
        "id": "resume-contract-untriagedCriticalScannerFinding",
        "uri": "artifact:fixture:resume-contract-untriagedCriticalScannerFinding",
        "digest": "sha256:a1f423717465d0952bbb5e7ec52cb20ec33f5ede94008fbc49d765f5e857fb01"
      },
      "rowDigest": "sha256:af70a890650fc65d2552d4d1f9d5de83a7861dcaddd48a67ecaa966d456b4e0a"
    },
    {
      "eventId": "heldOutLeakage",
      "claimEffect": "insufficient_evidence",
      "governanceStatus": "security_review_required",
      "stopAction": "stop_governance_use",
      "scopeAction": "revoke_affected_scope",
      "waivable": false,
      "triggerContract": {
        "id": "trigger-contract-heldOutLeakage",
        "uri": "artifact:fixture:trigger-contract-heldOutLeakage",
        "digest": "sha256:5ee7f8102c3e0f18456ed498ce1e1d87c679f4e0dd6889bf1df418aabec4be38"
      },
      "owner": {
        "id": "fixture-governance-owner",
        "role": "governance_owner"
      },
      "slaSeconds": 3600,
      "requiredEvidenceKinds": [
        "canonical_event_evidence"
      ],
      "terminalDisposition": "not_applicable_while_open",
      "resumeContract": {
        "id": "resume-contract-heldOutLeakage",
        "uri": "artifact:fixture:resume-contract-heldOutLeakage",
        "digest": "sha256:689649cad89e32bac388c384cdddb53d197cbe1112202bff401fccee8fe32957"
      },
      "rowDigest": "sha256:9949f69d77bcebe49b3da5a4b7319127bf8a8d9708b834d073416f2e0593c631"
    },
    {
      "eventId": "escapedCriticalDefect",
      "claimEffect": "insufficient_evidence",
      "governanceStatus": "manual_review_required",
      "stopAction": "freeze_scope",
      "scopeAction": "rollback_or_reduce",
      "waivable": true,
      "triggerContract": {
        "id": "trigger-contract-escapedCriticalDefect",
        "uri": "artifact:fixture:trigger-contract-escapedCriticalDefect",
        "digest": "sha256:d1e8a826a57933f9bc84af05c45f89f9496d072e670d9aaebef490a0f7749e88"
      },
      "owner": {
        "id": "fixture-governance-owner",
        "role": "governance_owner"
      },
      "slaSeconds": 3600,
      "requiredEvidenceKinds": [
        "canonical_event_evidence"
      ],
      "terminalDisposition": "not_applicable_while_open",
      "resumeContract": {
        "id": "resume-contract-escapedCriticalDefect",
        "uri": "artifact:fixture:resume-contract-escapedCriticalDefect",
        "digest": "sha256:452e65c5c5a8c991776a2ff5d948b27f00a29e50cedf9324dc627b3de8411b03"
      },
      "rowDigest": "sha256:ff4745649e2cf738d5921c583ec080732b24dfda3f9c5321a8b3e3b64bd56ee9"
    },
    {
      "eventId": "repeatedReviewRejection",
      "claimEffect": "insufficient_evidence",
      "governanceStatus": "manual_review_required",
      "stopAction": "block_scope_expansion",
      "scopeAction": "retain_or_reduce",
      "waivable": true,
      "triggerContract": {
        "id": "trigger-contract-repeatedReviewRejection",
        "uri": "artifact:fixture:trigger-contract-repeatedReviewRejection",
        "digest": "sha256:6a8be871fc890819200c10e3ece3a9d6ab85c46c27fc3c2f66f6dfe56758814d"
      },
      "owner": {
        "id": "fixture-governance-owner",
        "role": "governance_owner"
      },
      "slaSeconds": 3600,
      "requiredEvidenceKinds": [
        "canonical_event_evidence"
      ],
      "terminalDisposition": "not_applicable_while_open",
      "resumeContract": {
        "id": "resume-contract-repeatedReviewRejection",
        "uri": "artifact:fixture:resume-contract-repeatedReviewRejection",
        "digest": "sha256:3fb41e73e74fd516d8d48f7918d9e3482ab391fb06b84c4fe4a66678a0aa3fc6"
      },
      "rowDigest": "sha256:50ae78150641a2c8a705a8119a526c0bf7c79a5b58272ba03dd11eb4ed13be3b"
    },
    {
      "eventId": "staleMeasurement",
      "claimEffect": "insufficient_evidence",
      "governanceStatus": "manual_review_required",
      "stopAction": "block_acceptance",
      "scopeAction": "retain_valid_only",
      "waivable": true,
      "triggerContract": {
        "id": "trigger-contract-staleMeasurement",
        "uri": "artifact:fixture:trigger-contract-staleMeasurement",
        "digest": "sha256:775d553101827f49247091f5952491f42ef6e98b7b602dcebef4ac43e1515c29"
      },
      "owner": {
        "id": "fixture-governance-owner",
        "role": "governance_owner"
      },
      "slaSeconds": 3600,
      "requiredEvidenceKinds": [
        "canonical_event_evidence"
      ],
      "terminalDisposition": "not_applicable_while_open",
      "resumeContract": {
        "id": "resume-contract-staleMeasurement",
        "uri": "artifact:fixture:resume-contract-staleMeasurement",
        "digest": "sha256:23cf2eb5f5504327050f1863dea6fb34bedd4837fc264696a8c44318ece12e15"
      },
      "rowDigest": "sha256:fed4b61021d005db94f0deb3b80c0820ed6c06e9dbbc5d2e87e46dfd9e5ea41a"
    },
    {
      "eventId": "measurementErrorThreshold",
      "claimEffect": "insufficient_evidence",
      "governanceStatus": "manual_review_required",
      "stopAction": "block_metric",
      "scopeAction": "reduce_affected",
      "waivable": true,
      "triggerContract": {
        "id": "trigger-contract-measurementErrorThreshold",
        "uri": "artifact:fixture:trigger-contract-measurementErrorThreshold",
        "digest": "sha256:4ef30ac75f3753d88cfe07a1b7493e03980018593a3e0956ce177ee6d8d05b25"
      },
      "owner": {
        "id": "fixture-governance-owner",
        "role": "governance_owner"
      },
      "slaSeconds": 3600,
      "requiredEvidenceKinds": [
        "canonical_event_evidence"
      ],
      "terminalDisposition": "not_applicable_while_open",
      "resumeContract": {
        "id": "resume-contract-measurementErrorThreshold",
        "uri": "artifact:fixture:resume-contract-measurementErrorThreshold",
        "digest": "sha256:083c3672f75e77622998f478e7a6d4a403de3c89d2fce91f810372a34d6310a8"
      },
      "rowDigest": "sha256:04ba0684d478345595bd0f1322fe20cc7fad9b0ca8c3f43d50d6d9a77ecb6993"
    },
    {
      "eventId": "suiteHealthDegradation",
      "claimEffect": "insufficient_evidence",
      "governanceStatus": "manual_review_required",
      "stopAction": "block_suite",
      "scopeAction": "reduce_affected",
      "waivable": true,
      "triggerContract": {
        "id": "trigger-contract-suiteHealthDegradation",
        "uri": "artifact:fixture:trigger-contract-suiteHealthDegradation",
        "digest": "sha256:487bb7b763e6c30b11f3cefa573769ccd7e923cfa9ab7b24cf04f3b3eaed28d8"
      },
      "owner": {
        "id": "fixture-governance-owner",
        "role": "governance_owner"
      },
      "slaSeconds": 3600,
      "requiredEvidenceKinds": [
        "canonical_event_evidence"
      ],
      "terminalDisposition": "not_applicable_while_open",
      "resumeContract": {
        "id": "resume-contract-suiteHealthDegradation",
        "uri": "artifact:fixture:resume-contract-suiteHealthDegradation",
        "digest": "sha256:ff3b05ae7e30ee81ec7485a4d1105ff475662f2fc8b911280c9d81a521c735be"
      },
      "rowDigest": "sha256:f52b0e2117bf0ad702986d3d40acba496d01566c384c132be39da66116e9c175"
    },
    {
      "eventId": "decisionExpired",
      "claimEffect": "not_applicable",
      "governanceStatus": "manual_review_required",
      "stopAction": "revoke_approval",
      "scopeAction": "revoke_expired",
      "waivable": false,
      "triggerContract": {
        "id": "trigger-contract-decisionExpired",
        "uri": "artifact:fixture:trigger-contract-decisionExpired",
        "digest": "sha256:7a8f1c787a75a1c57929d792d0062a333bd88d4e2562fdfdc679fde94f7b0219"
      },
      "owner": {
        "id": "fixture-governance-owner",
        "role": "governance_owner"
      },
      "slaSeconds": 3600,
      "requiredEvidenceKinds": [
        "canonical_event_evidence"
      ],